{
  "brand": {
    "primary": "#111827",
    "secondary": "#1E3A8A",
    "accent": "#9CA3AF"
  },
  "neutrals": {
    "900": "#0B1120",
    "800": "#111827",
    "700": "#1F2937",
    "600": "#374151",
    "500": "#6B7280",
    "400": "#9CA3AF",
    "300": "#D1D5DB",
    "200": "#E5E7EB",
    "100": "#F3F4F6",
    "50": "#F9FAFB"
  },
  "semantic": {
    "success": "#16A34A",
    "warning": "#D97706",
    "error": "#DC2626",
    "info": "#2563EB"
  },
  "usage_rules": {
    "locked_main_palette": true,
    "allow_semantic_exceptions": true,
    "invent_new_brand_colors": false
  }
}
